Question,Answer
What issues can students address in counseling?,"Concerns that might benefit from counseling include: feelings of anxiety or depression, or concerning changes in mood; relationship difficulties; issues related to cultural, sexual, or gender identity; recent or past trauma; the death or loss of a loved one; drug or alcohol use, academic struggles, or anything else that might be impacting one's quality of life."
What happens during an initial screening appointment?,"A screening appointment involves meeting with a counselor who will assess your needs and determine the most appropriate services for you. This may include self-help resources, group counseling, individual counseling, or referral to a community provider.  "
How can students schedule an initial screening appointment?,"To schedule the first counseling appointment, students can call the University Counseling Center at  (616) 331-3266 or visit its Allendale location in 206 Student Services."
How much does counseling cost at the University Counseling Center?,University Counseling Center services are provided free of charge to currently enrolled GVSU students.
How many sessions are students allowed at the University Counseling Center?,Students are directed to the services most appropriate to their needs.  Individual counseling is available on a short-term basis.  Group counseling is offered as a longer-term treatment option.
What can the staff members assist with?,"Staff members are available to lead or collaborate on presentations, programs, and events across the campus."
How can a group of students request outreach programming?,Groups of students or campus organizations can request outreach programming by submitting a request on the University Counseling Center website.
What types of activities can staff lead or collaborate on?,"Staff members can lead or collaborate on a variety of presentations, programs, and events across the campus."
What outreach events does the University Counseling Center host?,"The University Counsleing Center hosts mental health screening days, Mental Health Ambassadors trainings, QPR Suicide Prevention Gatekeeper trainings, and other programs and events throughout the year.  Visit the Outreach page on the University Counseling Center website for dates and additional information."